{
  "$schema": "http://json-schema.org/draft-07/schema#",
  "title": "MicroSim Dublin Core Metadata Schema",
  "description": "JSON Schema for validating MicroSim metadata.json files using Dublin Core elements",
  "type": "object",
  "required": [
    "title",
    "description",
    "creator",
    "date",
    "subject",
    "type",
    "format",
    "language",
    "rights"
  ],
  "properties": {
    "title": {
      "type": "string",
      "description": "The name given to the MicroSim",
      "minLength": 1
    },
    "description": {
      "type": "string",
      "description": "An account of the MicroSim's purpose and functionality",
      "minLength": 1
    },
    "creator": {
      "type": "string",
      "description": "The person or organization primarily responsible for creating the MicroSim",
      "minLength": 1
    },
    "date": {
      "type": "string",
      "description": "Date of creation or publication (ISO 8601 format recommended)",
      "pattern": "^\\d{4}(-\\d{2}(-\\d{2})?)?$"
    },
    "subject": {
      "oneOf": [
        {"type": "string"},
        {
          "type": "array",
          "items": {"type": "string"},
          "minItems": 1
        }
      ],
      "description": "The topic or keywords describing the MicroSim's content"
    },
    "type": {
      "type": "string",
      "description": "The nature or genre of the resource (e.g., 'Interactive Simulation', 'Educational Software')",
      "minLength": 1
    },
    "format": {
      "type": "string",
      "description": "The file format or medium (e.g., 'text/html', 'application/javascript')",
      "minLength": 1
    },
    "language": {
      "type": "string",
      "description": "The language of the resource (ISO 639 code recommended, e.g., 'en', 'en-US')",
      "minLength": 2
    },
    "rights": {
      "type": "string",
      "description": "Information about rights held in and over the resource (e.g., 'CC BY 4.0', 'MIT License')",
      "minLength": 1
    },
    "contributor": {
      "oneOf": [
        {"type": "string"},
        {
          "type": "array",
          "items": {"type": "string"}
        }
      ],
      "description": "Additional contributors to the MicroSim"
    },
    "identifier": {
      "type": "string",
      "description": "An unambiguous reference to the resource (e.g., URL, DOI)"
    },
    "source": {
      "type": "string",
      "description": "A related resource from which this MicroSim is derived"
    },
    "relation": {
      "type": "string",
      "description": "A related resource (e.g., URL to related content)"
    },
    "coverage": {
      "type": "string",
      "description": "The spatial or temporal topic of the resource"
    },
    "publisher": {
      "type": "string",
      "description": "The entity responsible for making the resource available"
    },
    "educationalLevel": {
      "type": "string",
      "description": "The target educational level (e.g., 'high school', 'undergraduate', 'graduate')"
    },
    "learningResourceType": {
      "type": "string",
      "description": "The type of learning resource (e.g., 'simulation', 'interactive demonstration')"
    },
    "audience": {
      "type": "string",
      "description": "The intended audience for the MicroSim"
    },
    "version": {
      "type": "string",
      "description": "The version of the MicroSim"
    },
    "bloomLevel": {
      "oneOf": [
        {"type": "string"},
        {
          "type": "array",
          "items": {"type": "string"}
        }
      ],
      "description": "Bloom's Taxonomy cognitive level(s) addressed (e.g., 'Remember', 'Understand', 'Apply', 'Analyze', 'Evaluate', 'Create')"
    },
    "concepts": {
      "type": "array",
      "items": {"type": "string"},
      "description": "Key concepts demonstrated in the MicroSim"
    },
    "prerequisites": {
      "type": "array",
      "items": {"type": "string"},
      "description": "Prerequisite knowledge or concepts"
    },
    "library": {
      "type": "string",
      "description": "Primary JavaScript library used (e.g., 'p5.js', 'vis-network', 'Chart.js')"
    }
  },
  "additionalProperties": true
}
